{
  "actor": {
    "id": "repo-owner",
    "kind": "human"
  },
  "decision": "approved",
  "id": "APR-01KY6KEAQGDZW8C9GTAHMWBKZN",
  "independence_level": "L2",
  "kind": "scope",
  "recorded_at": "2026-07-23T04:23:45.759224Z",
  "schema_version": 1,
  "subject_ref": "tasks/TASK-01KY6J95XF3B60YF2TZP9YC8JM-full-regression-closure-successor/scope-contract.yaml#scope=SCOPE-01KY6J95XF3B60YF2TZP9YC8JN;version=1;digest=sha256:21788a9b075e026eb9cd11abcf5526b7227fcf32b3622c224ba552fc5aa1e539",
  "task_id": "TASK-01KY6J95XF3B60YF2TZP9YC8JM-full-regression-closure-successor"
}
