{
  "actor": {
    "id": "governance-owner",
    "kind": "human"
  },
  "decision": "approved",
  "id": "APR-01KY53ADZK46B7RCR0P0DKTYHP",
  "independence_level": "L2",
  "kind": "scope",
  "recorded_at": "2026-07-22T14:22:56.545701Z",
  "schema_version": 1,
  "subject_ref": "tasks/TASK-01KY4P812NAHXDYZDFJ2X3QK9H-github-authority-bootstrap-successor/scope-contract.yaml#scope=SCOPE-01KY4P812NAHXDYZDFJ2X3QK9J;version=2;digest=sha256:92fae4c74f5331f1125040ac6b36c12fc2a0ee79598ef3efee5de7f3267ec5c3",
  "task_id": "TASK-01KY4P812NAHXDYZDFJ2X3QK9H-github-authority-bootstrap-successor"
}
